#CODE;ENGLISH;FRENCH;GERMAN;;SPANISH;;;;;;;;;x
brm_revolt;Peasant Revolt;Révolte paysanne;Massive Revolte;;Massive revolt;;;;;;;;;x
brm_reduced_tax;Tax Reduction;Taxes réduites;Steuern reduziert;;Reduced tax;;;;;;;;;x
brm_rebel_offer_rejected;Rebel Offer Rejected;Offre Rebelle rejetée;Rebellen Angebot abgelehnt;;Rebels offer rejected;;;;;;;;;x
brm_isolated_province;Isolated Province;Province isolée;Isolierte Provinz;;Isolated province;;;;;;;;;x
EVTDESC1000025000;A revolt has broken out in [Root.GetName]! Angered by my 'oppressive' rule, the peasants have taken to arms.;Une révolte a éclaté à [Root.GetName] ! En colère contre mon 'règne tyrannique', les paysans ont pris les armes.;In [Root.GetName] ist eine Revolte ausgebrochen! Die Bauern sind wütend über meine 'Gewaltherrschaft' und haben daher zu den Waffen gegriffen.;;¡Ha estallado una revuelta en [Root.GetName]! Furiosos por mi 'gobierno opresor', los campesinos han tomado las armas.;;;;;;;;;x
EVTOPTA1000025000;How dare they oppose me!;Comment osent-ils s’opposer à moi !;Wie können sie es wagen, sich gegen mich zu stellen!;;¿Cómo osan oponerse a mí?;;;;;;;;;x
EVTDESC1000025001;A revolt has broken out in [From.GetName]! Angered by the oppressive rule of [From.County.Holder.GetTitledName], the peasants have taken to arms. Their indiscriminate destruction will unfortunately hit my holdings as well...;Une révolte a éclaté à [From.GetName] ! En colère contre le règne tyrannique de [From.County.Holder.GetTitledName], les paysans ont pris les armes. Ils détruisent tout sans discernement et risquent donc de s’en prendre à mes propriétés...;In [Root.GetName] ist eine Revolte ausgebrochen! Die Bauern sind wütend über die Gewaltherrschaft von [From.County.Holder.GetTitledName] und haben daher zu den Waffen gegriffen. Ihre wahllose Zerstörungswut wird leider auch meine Besitztümer treffen ...;;¡Ha estallado una revuelta en [From.GetName]! Furiosos por el gobierno opresor de [From.County.Holder.GetTitledName], los campesinos han tomado las armas. Por desgracia su destrucción indiscriminada también afectará a mis posesiones...;;;;;;;;;x
EVTOPTA1000025001;If the count doesn't act, I better...;Si le comte n’intervient pas, je le ferai...;Wenn der Graf nicht reagiert, sollte ich besser ...;;Si el conde no actúa, será mejor que yo...;;;;;;;;;x
EVTDESC1000025002;The peasant army ravageing the province of [Root.GetName] is burning down buildings!;L’armée de paysans qui ravage la province de [Root.GetName] incendie les édifices !;Die Bauernarmee, die gerade die Provinz [Root.GetName] verwüstet, brennt nun auch Gebäude nieder!;;¡El ejército de campesinos que asola la provincia de [Root.GetName] está quemando edificios!;;;;;;;;;x
EVTOPTA1000025002;Is there anything they won't destroy?;Y a-t-il quelque chose qu’ils comptent épargner ?;Gibt es irgendwas, das sie nicht zerstören würden?;;¿Dejarán algo sin destruir?;;;;;;;;;x
EVTOPTB1000025002;Bad news, but I am glad it didn't happen to my holdings...;Mauvaise nouvelle, mais je suis content(e) que mes propriétés ne soient pas concernées...;Schlechte Nachrichten, aber das betrifft meine Besitztümer nicht ....;;Malas noticias, pero me alegro de que no le pasara a mis posesiones...;;;;;;;;;x
EVTDESC1000025003;The peasant army ravageing the province of [From.GetName] is burning down my buildings!;L’armée de paysans qui ravage la province de [From.GetName] incendie mes édifices !;Die Bauernarmee, die gerade die Provinz von [From.GetName] verwüstet, brennt nun auch Gebäude nieder!;;¡El ejército de campesinos que asola la provincia de [From.GetName] está quemando edificios!;;;;;;;;;x
EVTDESC1000025004;I have been attacked by the peasants rebels in [Root.Location.GetName]!;Les paysans rebelles de [Root.Location.GetName] s’en sont pris à moi !;Die Bauernrebellen haben mich in [Root.Location.GetName] angegriffen!;;¡Los campesinos rebeldes me han atacado en [Root.Location.GetName]!;;;;;;;;;x
EVTOPTA1000025004;They killed me?!;Ils m’ont tué(e) ?!;Sie haben mich getötet?!;;¿Me han matado?;;;;;;;;;x
EVTOPTB1000025004;Damn these rebels!;Maudits rebelles !;Diese verdammten Rebellen ...;;¡Malditos rebeldes!;;;;;;;;;x
EVTOPTC1000025004;I am lucky to be alive...;J’ai de la chance d’être en vie...;Ich habe Glück, am Leben zu sein ...;;Tengo suerte de estar vivo...;;;;;;;;;x
EVTDESC1000025008;[From.GetTitledName] has been captured and killed by peasant rebels!;[From.GetTitledName] a été capturé(e) et tué(e) par les paysans rebelles !;[From.GetTitledName] wurde von Bauernrebellen gefangen und hingerichtet!;;¡[From.GetTitledName] ha sido capturado y asesinado por campesinos rebeldes!;;;;;;;;;x
EVTOPTA1000025008;How dare they execute a subject of mine!;Comment osent-ils exécuter un de mes sujets !;Wie können sie es wagen, einen meiner Untergebenen hinzurichten!;;¿Cómo osan ejecutar a un súbdito mío?;;;;;;;;;x
EVTDESC1000025009;My liege,\nI was ambushed by a mob of peasant rebels and barely got away with my life. The attack has left my maimed and I fear for the life of me and those around me in [From.Location.GetName]. These rebels must be stopped.\n\nSigned,\n[From.GetTitledName];Mon cher suzerain,\nJ’ai échappé de peu à la mort après avoir été pris(e) en embuscade par une foule de paysans rebelles. Après avoir été mutilé(e) au cours de l’attaque, je crains désormais pour ma vie et pour celle de ceux qui m’entourent à [From.Location.GetName]. Il faut absolument arrêter ces rebelles.\n\Signé,\n[From.GetTitledName];Mein Lehnsherr,\nEine Schar Bauernrebellen hat mir einen Hinterhalt gelegt. Ich bin gerade so mit dem Leben davongekommen, wurde aber verstümmelt. Nun sorge ich mich um mein Leben und um das meiner Begleiter in [From.Location.GetName]. Diese Rebellen müssen aufgehalten werden.\n\Gezeichnet,\n[From.GetTitledName];;Mi señor,\nFui emboscado por una turba de campesinos rebeldes y logré huir a duras penas. El ataque me dejó lisiado y temo por mi vida y la de los que me rodean en [From.Location.GetName]. Hay que parar a esos rebeldes.\n\Firmado,\n[From.GetTitledName];;;;;;;;;x
EVTOPTA1000025009;They sure do...;Oui, il le faut...;In der Tat ...;;Sin duda lo serán...;;;;;;;;;x
EVTDESC1000025010;My liege,\nAlthough I escaped with my life, the mob of peasant rebels that attacked me managed to wound me. I fear these attacks will only increase until the revolt in [From.Location.GetName] is put down.\nSigned,\n[From.GetTitledName];Mon cher suzerain,\nJe m’en suis sorti(e), mais les paysans rebelles qui s’en sont pris à moi ont réussi à me blesser. Je crains que ces attaques ne s’intensifient tant que la révolte de [From.Location.GetName] ne sera pas matée.\nSigné,\n[From.GetTitledName];Mein Lehnsherr,\nIch entkam zwar mit meinem Leben, aber die Schar angreifender Bauernrebellen hat mich verwundet. Wenn die Revolte in [From.Location.GetName] nicht niedergeschlagen wird, werden diese Angriffe wohl noch zunehmen.\nGezeichnet,\n[From.GetTitledName];;Mi señor,\nAunque logré huir, la turba de campesinos rebeldes que me atacó logró herirme. Me temo que estos ataques no harán más que aumentar hasta que la revuelta en [From.Location.GetName] sea sofocada.\nFirmado,\n[From.GetTitledName];;;;;;;;;x
EVTOPTA1000025010;This peasant rabble must be stopped!;Il faut absolument arrêter ces paysans !;Dieser Bauernpöbel muss aufgehalten werden!;;¡Hay que parar a esa chusma!;;;;;;;;;x
EVTDESC1000025012;Tired of their old ruler, the peasant rebels of [Root.GetName] have defected and sworn allegiance to me!;Lassés de leur vieux souverain, les paysans rebelles de [Root.GetName] ont fait défection et m'ont prêté allégeance !;Der Herrschaft ihres alten Lehnsherren müde geworden, haben die abtrünnigen Bauern in [Root.GetName] Eurer Majestät die Treue geschworen!;;¡Cansados de su antiguo líder, los campesinos rebeldes de [Root.GetName] han desertado y me juran lealtad!;;;;;;;;;x
EVTOPTA1000025012;Excellent! Or is it...?;Excellent ! Quoique, l'est-ce vraiment ?;Vortrefflich! Oder etwa nicht …?;;¡Excelente! ¿O quizás no...?;;;;;;;;;x
EVTOPTA1000025014;Damn these peasants!;Maudits soient ces paysans !;Verdammtes Bauerngesindel!;;¡Al diablo con esos campesinos!;;;;;;;;;x
EVTOPTA1000025015;Outrages!;Outrage !;Unerhört!;;¡Agravio!;;;;;;;;;x
EVTDESC1000025011;A rebel army has risen up in [Root.GetName].;Une armée rebelle est apparue à [Root.GetName].;Eine Rebellenarmee hat sich in  [Root.GetName] grupiert.;A rebel army has risen up in [Root.GetName].;A rebel army has risen up in [Root.GetName].;;;;;;;;x;
EVTOPTA1000025011;Argh!;Argh!;Argh!;;Argh!;;;;;;;;;x
EVTDESC1000025013;A rebel army has risen up in [From.Location.GetName].;Une armée rebelle est apparue à [From.Location.GetName].;Eine Rebellenarmee hat sich in [From.Location.GetName] grupiert.;A rebel army has risen up in [From.Location.GetName].;A rebel army has risen up in [From.Location.GetName].;;;;;;;;x;
EVTOPTA1000025013;Argh!;Argh!;Argh!;;Argh!;;;;;;;;;x
EVTDESC1000025030;Revolting peasants in [Root.GetName] will depose arms if you agree to reduce their taxes;Les paysans révoltés à [Root.GetName] déposeront les armes si vous acceptez de réduire les taxes.;Aufständischen Bauern in [Root.GetName] werden die Waffen niederlegen wenn Sie zustimmen die Steuern zu senken.;;Revolting peasants in [Root.GetName] will depose arms if you agree to reduce their taxes;;;;;;;;;x
EVTOPTA1000025030;Very well;Très bien.;Sehr gut;;Very well;;;;;;;;;x
EVTOPTB1000025030;Don`t listen those peasant scum!;N'écoutez pas ces gueux!;Hören Sie nicht auf diesen Bauern Abschaum!;;Don`t listen those peasant scum!;;;;;;;;;x
EVTNAME1000025031;Revolt suppressed;Révolte supprimée.;Revolte unterdrückt;;Revolt suppressed;;;;;;;;;x
EVTDESC1000025031;I arrived to [Root.Location.GetName] and managed to find and arrest revolt leaders. Without them peasants will not dare to oppose my liege any more;Je suis arrivé à [Root.Location.GetName] et tente de trouvé ainsi que d'arrêter les meneurs de la révolte. Sans eux les paysans n'auront plus l'audace de s'opposer à mon suzerain.;Ich kam auf [Root.Location.GetName] an und nahm den Anführer der Revolte gefangen. Ohne diesen werden die Bauern es nicht wagen, sich  meiner Herschaft zu widersetzen;;I arrived to [Root.Location.GetName] and managed to find and arrest revolt leaders. Without them peasants will not dare to oppose my liege any more;;;;;;;;;x
EVTOPTA1000025031;They learned their lesson!;Ils ont appris la leçon!;Sie haben ihre Lektion gelernt;;They learned their lesson!;;;;;;;;;x
EVTTOOLTIP1000025032;Send a letter to my liege;Envoyer une lettre à mon suzerain. ;Sendet Brife an meinen Lehnsherren;;Send a letter to my liege;;;;;;;;;x
EVTDESC1000025032;My liege, I managed to find and arrest revolt leaders in [From.Location.GetName]. Without them peasants will not dare to oppose you any more.;Mon suzerain, je tente de trouver et d'arrêter les meneurs de la révolte à [From.Location.GetName]. Sans eux les paysans n'auront plus l'audace de s'opposer à vous.;Mein Lehnsherr , ich fand  den Anführer der Revolte in [From.Location.GetName] und kerkerte ich ein.Ohne diesen werden die Bauern es nicht wagen, sich  meiner Herschaft zu widersetzen;;My liege, I managed to find and arrest revolt leaders in [From.Location.GetName]. Without them peasants will not dare to oppose you any more.;;;;;;;;;x
EVTOPTA1000025032;Good news!;Bonne nouvelle!;Gute Nachrichten !;;Good news!;;;;;;;;;x
